<?xml version="1.0" encoding="UTF-8"?>
<!--


    Copyright (C) 2002-2012 "SYSNET International, Inc."
    support@sysnetint.com [http://www.sysnetint.com]

    This file is part of OpenEMPI.

    OpenEMPI is free software: you can redistribute it and/or modify
    it under the terms of the GNU Affero General Public License as
    published by the Free Software Foundation, either version 3 of the
    License, or (at your option) any later version.

    This program is distributed in the hope that it will be useful,
    but WITHOUT ANY WARRANTY; without even the implied warranty of
    MERCHANTABILITY or FITNESS FOR A PARTICULAR PURPOSE.  See the
    GNU Affero General Public License for more details.

    You should have received a copy of the GNU Affero General Public License
    along with this program. If not, see <http://www.gnu.org/licenses/>.

-->
<mpi-config
	xsi:schemaLocation="http://configuration.openempi.openhie.org/mpiconfig mpi-config.xsd
	http://configuration.openempi.openhie.org/file-loader file-loader.xsd
	http://configuration.openempi.openhie.org/basic-blocking basic-blocking-hp.xsd
	http://configuration.openempi.openhie.org/probabilistic-matching probabilistic-matching.xsd
	http://configuration.openempi.openhie.org/exact-matching exact-matching.xsd"
	xmlns="http://configuration.openempi.openhie.org/mpiconfig"
	xmlns:mpi="http://configuration.openempi.openhie.org/mpiconfig"
	xmlns:fl="http://configuration.openempi.openhie.org/file-loader"
	xmlns:bb="http://configuration.openempi.openhie.org/basic-blocking-hp"
	xmlns:em="http://configuration.openempi.openhie.org/exact-matching"
	xmlns:pm="http://configuration.openempi.openhie.org/probabilistic-matching"
	xmlns:xsi="http://www.w3.org/2001/XMLSchema-instance">

    <global-identifier>
        <assign-global-identifier>true</assign-global-identifier>
        <namespace-identifier>NIST2010</namespace-identifier>
        <universal-identifier>2.16.840.1.113883.3.72.5.9.1</universal-identifier>
        <universal-identifier-type>ISO</universal-identifier-type>
	<identifier-domain-name>NIST2010</identifier-domain-name>
    </global-identifier>
<!--
    <scheduled-tasks>
    	<scheduled-task schedule-type="schedule-at-fixed-rate" time-unit="seconds">
    	    <task-name>test</task-name>
    	    <task-implementation>dataProfiler</task-implementation>
    	    <initial-delay>30</initial-delay>
    	    <period>86400</period>
    	</scheduled-task>
    </scheduled-tasks>
-->
    <custom-fields>
        <custom-field>
            <field-name>custom1</field-name>
            <source-field-name>familyName</source-field-name>
            <transformation-function>
                <function-name>Nysiis</function-name>
	    </transformation-function>
        </custom-field>
        <custom-field>
            <field-name>custom2</field-name>
            <source-field-name>givenName</source-field-name>
            <transformation-function>
                <function-name>DoubleMetaphone</function-name>
	    </transformation-function>
        </custom-field>
        <custom-field>
            <field-name>custom3</field-name>
            <source-field-name>familyName</source-field-name>
            <transformation-function>
                <function-name>Substring</function-name>
                <parameters>
                    <parameter>
                        <name>end</name>
                        <value>4</value>
                    </parameter>
                </parameters>
            </transformation-function>
        </custom-field>
        <custom-field>
            <field-name>custom4</field-name>
            <source-field-name>dateOfBirth</source-field-name>
            <transformation-function>
                <function-name>DateTransformationFunction</function-name>
                <parameters>
                    <parameter>
                        <name>dateFormat</name>
                        <value>MM.yyyy</value>
                    </parameter>
                </parameters>
            </transformation-function>
        </custom-field>
        <custom-field>
            <field-name>custom5</field-name>
            <source-field-name>personIdentifiers</source-field-name>
            <transformation-function>
                <function-name>IdentifierTransformationFunction</function-name>
                <parameters>
                    <parameter>
                        <name>identifierDomainName</name>
                        <value>Unknown</value>
                    </parameter>
                </parameters>
            </transformation-function>
        </custom-field>
    </custom-fields>
    <bb:basic-blocking>
        <bb:blocking-rounds>
            <bb:blocking-round>
                <bb:blocking-fields>
                    <bb:blocking-field>
                        <bb:field-name>custom1</bb:field-name>
                    </bb:blocking-field>
                 <bb:blocking-field>
                        <bb:field-name>custom2</bb:field-name>
                    </bb:blocking-field>
                </bb:blocking-fields>
            </bb:blocking-round>
        </bb:blocking-rounds>
    </bb:basic-blocking>
    <em:exact-matching>
        <em:match-fields>
            <em:match-field>
                <em:field-name>familyName</em:field-name>
                <em:comparator-function>
                    <function-name>Exact</function-name>
                </em:comparator-function>
                <em:match-threshold>0.99</em:match-threshold>
            </em:match-field>
	   <em:match-field>
                <em:field-name>givenName</em:field-name>
                <em:comparator-function>
                    <function-name>Exact</function-name>
                </em:comparator-function>
                <em:match-threshold>0.99</em:match-threshold>
            </em:match-field>
        </em:match-fields>
    </em:exact-matching>
    <admin-configuration>
        <file-repository-directory>fileRepository</file-repository-directory>
        <autostart-pixpdq>false</autostart-pixpdq>
        <update-notification-entries>
            <update-notification-entry>
		<identifier-domain-name>NIST2010</identifier-domain-name>
                <user>admin</user>
                <!-- Number of days that an update notification entry will be preserved before it is deleted -->
                <time-to-live>30</time-to-live>
            </update-notification-entry>
        </update-notification-entries> 
    </admin-configuration>
</mpi-config>
